{
  "engine_id":"TRN-001","name":"Training Engine","layer":"L1","company_scope":"GLOBAL_OR_SCOPED","company_id":"fenix-capital","environment":"LAB","version":"documented-2026-09-07","contract_version":"0.1.0","status":"DOCUMENTED_PARTIAL","objective":"Entrenar, comparar y validar candidatos de motores sin promover directamente a PROD.","owner":"CEREBRO","inputs":["candidates","datasets","evaluation_results"],"outputs":["trained_candidates","evaluation_evidence","promotion_candidates"],"knowledge_sources":["master_motors","recent_notion_training_evidence"],"data_contracts":[],"api_contract":[],"permissions":["LAB_ONLY","NO_PROD_CREDENTIAL_SHARING"],"policies":["blind_validation","tribunal_before_promotion","no_direct_training_to_prod"],"events_in":["TRAINING_REQUESTED"],"events_out":["CANDIDATE_EVALUATED","PROMOTION_CANDIDATE"],"jobs":[],"tests":["candidate_isolation","blind_split","no_order_sent_for_trading"],"evaluation":["judge_scores","blind_validation"],"observability":["training_runs","evaluation_evidence"],"retry_timeout":{"max_attempts":1},"cost_budget":{"additional_monthly_eur_target":0},"backup":{"strategy":"versioned_training_artifacts"},"rollback":{"strategy":"discard_candidate_and_restore_previous_champion"},"rebuild":{"strategy":"replay_training_from_versioned_dataset_and_config"},"dependencies":["POL-001","HEX-001"],"dependents":["LAB-TRD"],"autonomy_level":"HUMAN_BY_EXCEPTION","zero_cost_execution_plan":["local_or_existing_compute","deterministic_evaluation_before_paid_AI"],"human_exception_codes":["LOW_CONFIDENCE","HIGH_RISK","POLICY_CONFLICT","SECURITY_INCIDENT","MONEY_LIMIT"],"evidence":["master marks Training operational","recent Notion evidence documents candidates/judges/validation","direct transversal runtime not verified in current connector audit"]
}
