{
  "engine_id":"LAB-TRD","name":"Trading LAB","layer":"L3","company_scope":"COMPANY_SCOPED","company_id":"fenix-capital","environment":"LAB","version":"documented-2026-09-04","contract_version":"0.1.0","status":"DOCUMENTED_PARTIAL","objective":"Investigar y validar estrategias de trading en aislamiento PAPER/SHADOW sin compartir credenciales ni capacidad de ejecución real con CEREBRO PROD.","owner":"CEREBRO","inputs":["market_data","strategies","training_candidates"],"outputs":["paper_results","shadow_results","judge_evidence"],"knowledge_sources":["master_motors","recent_notion_trading_evidence"],"data_contracts":[],"api_contract":[],"permissions":["LAB_ISOLATED","NO_REAL_ORDER_PERMISSION","NO_PROD_CREDENTIAL_SHARING"],"policies":["no_real_order","no_direct_lab_to_prod","champion_requires_tribunal"],"events_in":["TRADING_EXPERIMENT_REQUESTED"],"events_out":["TRADING_EVALUATION_READY"],"jobs":[],"tests":["NO_ORDER_SENT","SHADOW_LIVE","TRAIN_SPLIT","EXECUTION_RECONCILIATION"],"evaluation":["walk_forward_blind","judges","shadow_performance"],"observability":["paper_ledger","shadow_ledger","judge_results"],"retry_timeout":{"max_attempts":1},"cost_budget":{"additional_monthly_eur_target":0},"backup":{"strategy":"isolated_lab_artifacts_and_configs"},"rollback":{"strategy":"stop_lab_services_and_restore_previous_champion"},"rebuild":{"strategy":"rebuild_isolated_lab_from_versioned_configs_and_artifacts"},"dependencies":["TRN-001","POL-001","HEX-001"],"dependents":[],"autonomy_level":"HUMAN_BY_EXCEPTION","zero_cost_execution_plan":["existing_isolated_vm_and_open_source_stack"],"human_exception_codes":["HIGH_RISK","POLICY_CONFLICT","SECURITY_INCIDENT","MONEY_LIMIT","IRREVERSIBLE_PROD_RISK"],"evidence":["recent Notion P7/P9/P10/P15/P20/P38 PASS evidence","direct VM live state not verified today"]
}
